name,url,used_for
UEFA official match report,https://www.uefa.com/uefachampionsleague/news/02a5-20c02e59f219-15e92acdc717-1000--paris-retain-champions-league-holders-edge-arsenal-on-pena/,"Final score, timeline events, substitution list, penalty failures, and player of the match."
Opta Analyst match report,https://theanalyst.com/articles/psg-vs-arsenal-champions-league-final-stats,"Shots, possession record, pre-match win probability, first-half pass fact, and Vitinha's Champions League profile."
Sports Illustrated match-stat summary,https://www.si.com/soccer/arsenal-extend-unwanted-champions-league-record-after-heartbreaking-final-defeat,Completed-pass comparison and Opta possession note.
UEFA Player of the Match article,https://www.uefa.com/uefachampionsleague/news/02a5-20c0324a93c4-a269d65f5aeb-1000--vitinha-named-official-2026-uefa-champions-league-final-play/,Vitinha official Player of the Match context.
VG live report,https://www.vg.no/sport/i/L4Px4Q/champions-league-finalen-arsenal-leiren-reagerer-etter-omdiskutert-straffesituasjon-mot-psg,Penalty shootout sequence cross-check.
